120,"George MacKenzie, 198 games",George MacKenzie,MacKenzie.pgn,MacKenzie,George,MacKenzie,,,,,,,,George+MacKenzie+chess,https://en.wikipedia.org/w/index.php?search=George+MacKenzie+chess,"['George Mackenzie', 'USS George K. MacKenzie (DD-836)', 'George MacKenzie (wrestler)', 'Hector MacKenzie, Baron MacKenzie of Culkein', 'George P. MacKenzie', 'Mackenzie (surname)', 'George K. MacKenzie', 'Alexander Mackenzie', 'William Sutherland (police officer)', 'Alastair George MacKenzie']",George Mackenzie,https://en.wikipedia.org/wiki/George_Henry_Mackenzie,"George Henry Mackenzie (24 March 1837, North Kessock, Scotland – 14 April 1891, New York City) was a Scottish-American chess master.",George Henry Mackenzie
121,"Vladimir Malakhov, 1697 games",Vladimir Malakhov,Malakhov.pgn,Malakhov,Vladimir,Malakhov,Vladimir,Vladimir Malakhov ,1980-11-27,,1998-01-01, Russia,,Vladimir+Malakhov+chess,https://en.wikipedia.org/w/index.php?search=Vladimir+Malakhov+chess,"['Vladimir Malakhov', 'Vladimir Malakhov (chess player)', 'Vladimir Malakhov (footballer)', 'Vladimir Malakhov (ice hockey)', 'Malakhov', 'Vladimir Malakhov (dancer)', 'Transnistrian presidential election, 1996', 'Berlin State Ballet', 'Chess World Cup 2005', 'Polina Semionova']",Vladimir Malakhov,https://en.wikipedia.org/wiki/Vladimir_Malakhov_(chess_player),"Vladimir Malakhov (Russian: Владимир Малахов; born 27 November 1980) is a Russian chess grandmaster (1998). He was a member of the gold medal-winning Russian team at the World Team Chess Championship 2009 in Bursa.
Born in Ivanovo, Malakhov is a professional chess player, who used to work as a nuclear physicist.",Vladimir Malakhov (chess player)
122,"Shakhriyar Mamedyarov, 2169 games",Shakhriyar Mamedyarov,Mamedyarov.pgn,Mamedyarov,Shakhriyar,Mamedyarov,Shakhriyar,Shakhriyar Mamedyarov ,1985-04-12,,2002-01-01, Azerbaijan,,Shakhriyar+Mamedyarov+chess,https://en.wikipedia.org/w/index.php?search=Shakhriyar+Mamedyarov+chess,"['Shakhriyar Mamedyarov', 'Shamkir Chess', 'Tal Memorial', 'FIDE Grand Prix 2012–13', 'Ahmed Adly', 'Shahriyar', 'Igor Kurnosov', 'S. P. Sethuraman', 'Yaroslav Zherebukh', 'Sergei Azarov']",Shakhriyar Mamedyarov,https://en.wikipedia.org/wiki/Shakhriyar_Mamedyarov,"Shakhriyar Hamid oglu Mammadyarov (Azerbaijani: Şəhriyar Həmid oğlu Məmmədyarov; born 12 April 1985), also known as Shah and Shak, is an Azerbaijani chess Grandmaster.
Mamedyarov is a two-time World Junior Champion (the only male player to have won it more than once), 2013 World Rapid Chess Champion, gold-medalist at the 2012 Chess Olympiad on the third board and European Team Championships in 2009 and 2013. He is also a two time winner of Tal Memorial (2010 and 2014) and Shamkir Chess tournament (2016 and 2017). Mamedyarov played in the FIDE Candidates Tournament twice, in 2011 and 2014.",Shakhriyar Mamedyarov
123,"Geza Maroczy, 756 games",Geza Maroczy,Maroczy.pgn,Maroczy,Geza,Maroczy,,,,,,,,Geza+Maroczy+chess,https://en.wikipedia.org/w/index.php?search=Geza+Maroczy+chess,"['Géza Maróczy', 'Maroczy', 'Maróczy Bind', 'Nuremberg 1896 chess tournament', 'Imre Korody', 'Paul Johner', 'Pál Réthy', 'Miklós Bródy', 'New York 1924 chess tournament', 'Adolf Georg Olland']",Géza Maróczy,https://en.wikipedia.org/wiki/G%C3%A9za_Mar%C3%B3czy,"Géza Maróczy (Hungarian pronunciation: [ˈmɒroːt͡si ˈɡeːzɒ]; 3 March 1870 – 29 May 1951) was a leading Hungarian chess master, one of the best players in the world in his time. He was also a practicing engineer.",Géza Maróczy
124,"Frank Marshall, 1027 games",Frank Marshall,Marshall.pgn,Marshall,Frank,Marshall,,,,,,,,Frank+Marshall+chess,https://en.wikipedia.org/w/index.php?search=Frank+Marshall+chess,"['Frank Marshall', 'Frank Marshall (producer)', 'Frank Marshall (chess player)', 'Frank Marshall, Baron Marshall of Leeds', 'Frank Marshall (pianist)', 'Frank Marshall (footballer, born 1929)', 'Frank Marshall (footballer, born 1904)', 'Frank Marshall Davis', 'Thomas Frank Marshall', 'Lord Marshall']",Frank Marshall,https://en.wikipedia.org/wiki/Frank_Marshall_(chess_player),"Frank James Marshall (August 10, 1877 – November 9, 1944) was the U.S. Chess Champion from 1909 to 1936, and one of the world's strongest chess players in the early part of the 20th century.",Frank Marshall (chess player)
125,"Alexander McDonnell, 106 games",Alexander McDonnell,McDonnell.pgn,McDonnell,Alexander,McDonnell,,,,,,,,Alexander+McDonnell+chess,https://en.wikipedia.org/w/index.php?search=Alexander+McDonnell+chess,"['Alexander McDonnell', 'Alexander McDonnell, 9th Earl of Antrim', 'McDonnell (surname)', 'Alexander McDonnell (disambiguation)', 'Flora McDonnell', 'Alexander MacDonnell', 'Alexander McDonnell (engineer)', 'Sir Alexander Macdonnell, 1st Baronet', 'La Bourdonnais – McDonnell chess matches', 'Alexander Macdonell']",Alexander McDonnell,https://en.wikipedia.org/wiki/Alexander_McDonnell,"Alexander McDonnell (1798–1835) was an Irish chess master, who contested a series of six matches with the world’s leading player Louis-Charles Mahé de La Bourdonnais in the summer of 1834.",Alexander McDonnell
126,"Luke McShane, 1250 games",Luke McShane,McShane.pgn,McShane,Luke,McShane,Luke,Luke McShane ,1984-01-07,,2000-01-01, England,,Luke+McShane+chess,https://en.wikipedia.org/w/index.php?search=Luke+McShane+chess,"['Luke McShane', 'Luke McShane (footballer)', 'Paul McShane (footballer)', 'McShane (name)', 'Matthew McShane', 'Shane McMahon', 'London Chess Classic', 'Luís Galego', ""St Luke's High School"", 'Eduardas Rozentalis']",Luke McShane,https://en.wikipedia.org/wiki/Luke_McShane,"Luke James McShane (born 7 January 1984) is an English chess player. A former World Youth Champion and chess prodigy, he has become one of England's leading players and a member of the Olympiad team. He has also been a trader in London's financial sector.",Luke McShane
127,"Henrique Mecking, 579 games",Henrique Mecking,Mecking.pgn,Mecking,Henrique,Mecking,Henrique,Henrique Mecking ,1952-01-23,,1972-01-01, Brazil,,Henrique+Mecking+chess,https://en.wikipedia.org/w/index.php?search=Henrique+Mecking+chess,"['Henrique Mecking', 'Henrique', 'João de Souza Mendes', 'Raimundo Garcia', 'Tan Lian Ann', 'Jorge Szmetan', 'Khosro Harandi', 'Oscar Quiñones (chess player)', 'Miguel Cuéllar', 'San Antonio 1972 chess tournament']",Henrique Mecking,https://en.wikipedia.org/wiki/Henrique_Mecking,"Henrique Costa Mecking (born 23 January 1952), also known as Mequinho, is a Brazilian chess grandmaster who reached his zenith in the 1970s and is still one of the strongest players in Brazil. He was a chess prodigy, drawing comparisons to Bobby Fischer, although he did not achieve the International Grandmaster title until 1972. He won the Interzonals of Petropolis 1973 and Manila 1976. His highest FIDE rating is 2635, achieved in 1977, when he was ranked No. 3 in the world http://www.olimpbase.org/Elo/Elo197801e.html He is the first Brazilian to become a grandmaster. Despite winning his first national championship at the age of 13, he played in very few tournaments. He won at Vršac in 1971 and finished third with Robert Byrne (after the co-winners Anatoly Karpov and Viktor Korchnoi) at Hastings in 1971–72. In 1975, he twice shared second place behind Ljubomir Ljubojević, firstly at Las Palmas with Ulf Andersson and Mikhail Tal and then at Manila with Lev Polugaevsky, Bent Larsen and Helmut Pfleger.
He was considered a contender for the World Championship in the mid-1970s, however his chess career was interrupted by a serious illness.
Mecking played for Brazil in the Chess Olympiads of 1968, 1974, 2002 and 2004.",Henrique Mecking
128,"Vladas Mikenas, 497 games",Vladas Mikenas,Mikenas.pgn,Mikenas,Vladas,Mikenas,,,,,,,,Vladas+Mikenas+chess,https://en.wikipedia.org/w/index.php?search=Vladas+Mikenas+chess,"['Vladas Mikėnas', 'Mikėnas', 'Vladas', 'Baltic Chess Championship', 'Vladimirs Petrovs', 'Lithuanian Chess Championship', 'Iivo Nei', 'Theodor Germann', 'Vidrik Rootare', 'Isakas Vistaneckis']",Vladas Mikėnas,https://en.wikipedia.org/wiki/Vladas_Mik%C4%97nas,"Vladas Mikėnas (17 April 1910 – 3 November 1992) was a Lithuanian International Master of chess, an Honorary Grandmaster, and a journalist.",Vladas Mikėnas
129,"Anthony Miles, 2614 games",Anthony Miles,Miles.pgn,Miles,Anthony,Miles,Tony,Tony Miles,1955-04-23,2001-11-12,1976-01-01, England,,Anthony+Miles+chess,https://en.wikipedia.org/w/index.php?search=Anthony+Miles+chess,"['Tony Miles (disambiguation)', 'Anthony Miles (Australian footballer)', 'Anthony Miles (basketball)', 'Miles Benjamin Anthony Robinson', 'Tony Miles', 'A. D. Miles', 'St. Anthony, Minnesota', 'St. Anthony, Idaho', 'Anthony, Kansas', 'Anthony, Texas']",Tony Miles (disambiguation),https://en.wikipedia.org/wiki/Tony_Miles,"Anthony John Miles (23 April 1955 – 12 November 2001) was an English chess Grandmaster, the first Englishman to earn the Grandmaster title in over-the-board play.",Tony Miles
130,"Vadim Milov, 1381 games",Vadim Milov,Milov.pgn,Milov,Vadim,Milov,Leonid,,,,,,,Vadim+Milov+chess,https://en.wikipedia.org/w/index.php?search=Vadim+Milov+chess,"['Vadim Milov', 'Milov', 'Marc Tyler Arnold', 'Tamaz Gelashvili', 'Alexander Shabalov', 'Sergey Zagrebelny', 'Gadir Guseinov', 'FIDE World Chess Championship 1999', 'Alexandra Kosteniuk', 'List of Israeli chess players']",Vadim Milov,https://en.wikipedia.org/wiki/Vadim_Milov,Vadim Milov (born 1 August 1972) is a Swiss grandmaster of chess.,Vadim Milov
131,"Alexander Morozevich, 2149 games",Alexander Morozevich,Morozevich.pgn,Morozevich,Alexander,Morozevich,Alexander,Alexander Morozevich ,1977-07-18,,1994-01-01, Russia,,Alexander+Morozevich+chess,https://en.wikipedia.org/w/index.php?search=Alexander+Morozevich+chess,"['Alexander Morozevich', 'Chigorin Defense', 'Sergei Rublevsky', 'Amber chess tournament', 'Tal Memorial', 'Chess World Cup 2000', '2001 in chess', '4NCL', 'Chess World Cup 2002', '2002 in chess']",Alexander Morozevich,https://en.wikipedia.org/wiki/Alexander_Morozevich,"Alexander Sergeyevich Morozevich (Russian: Александр Серге́евич Морозе́вич; born July 18, 1977) is a Russian chess Grandmaster.
Morozevich is a two-time World Championship Candidate (2005, 2007), two-time Russian Champion and has represented Russia in seven Olympiads, winning numerous team and board medals.
He has won both the Melody Amber (alone 2002, shared 2004, 2006, 2008) and Biel (2003, 2004, 2006) tournaments several times.
Morozevich is known for his aggressive and unorthodox playing style. His peak ranking was second in the world in July 2008.",Alexander Morozevich
132,"Paul Morphy, 211 games",Paul Morphy,Morphy.pgn,Morphy,Paul,Morphy,,,,,,,,Paul+Morphy+chess,https://en.wikipedia.org/w/index.php?search=Paul+Morphy+chess,"['Paul Morphy', 'Alonzo Morphy', 'Staunton–Morphy controversy', 'Morphy number', 'Morphy (disambiguation)', 'Morphy versus the Duke of Brunswick and Count Isouard', 'Frederick Deacon', 'Félix Sicre', 'Paul Murphy', 'American Chess Association']",Paul Morphy,https://en.wikipedia.org/wiki/Paul_Morphy,"Paul Charles Morphy (June 22, 1837 – July 10, 1884) was an American chess player. He is considered to have been the greatest chess master of his era and an unofficial World Chess Champion. He was a chess prodigy. He was called ""The Pride and Sorrow of Chess"" because he had a brilliant chess career but retired from the game while still young. Bobby Fischer included him in his list of the ten greatest players of all time, and described him as ""perhaps the most accurate player who ever lived"".
Morphy was born in New Orleans, Louisiana, to a wealthy and distinguished family. He learned to play chess by simply watching games between his father and uncle. His family soon recognised the boy's talent and encouraged him to play at family gatherings, and by the age of nine he was considered to be one of the best players in New Orleans. At just twelve years of age, Morphy defeated visiting Hungarian master Johann Löwenthal in a match of three games.
After receiving his degree in 1857, Morphy was not yet of legal age to practice law and found himself with free time. He received an invitation to play at the First American Chess Congress in New York City, and, at his uncle's urging, accepted. Morphy won the tournament, which included strong players such as Alexander Meek and Louis Paulsen. Morphy was hailed as the chess champion of the United States and stayed in New York playing chess through 1857, winning the vast majority of his games. In 1858, Morphy travelled to Europe to play European Champion Howard Staunton. Morphy played almost every strong player in Europe, usually winning easily. The match with Staunton never materialized, but Morphy was hailed by most in Europe as the world's best player.
Returning to the United States in triumph, Morphy toured the major cities playing chess on his way back to New Orleans. By 1859, on returning to New Orleans, Morphy declared he was retiring from chess to begin his law career. However, Morphy was never able to establish a successful law practice and ultimately lived a life of idleness, living off his family's fortune. Despite appeals from his chess admirers, Morphy never returned to the game, and died in 1884 from a stroke at the age of 47.",Paul Morphy
133,"Alexander Motylev, 1696 games",Alexander Motylev,Motylev.pgn,Motylev,Alexander,Motylev,Alexander,Alexander Motylev ,1979-06-17,,2000-01-01, Russia,,Alexander+Motylev+chess,https://en.wikipedia.org/w/index.php?search=Alexander+Motylev+chess,"['Alexander Motylev', '2014 European Individual Chess Championship', 'Arnaud Hauchard', 'Alexander Lastin', 'Michael Roiz', 'Vladimir Akopian', 'Ivan Bukavshin', 'Liang Chong', 'Dragan Šolak', 'Boris Savchenko']",Alexander Motylev,https://en.wikipedia.org/wiki/Alexander_Motylev,"Alexander Anatolyevich Motylev (Russian: Александр Анатольевич Мотылёв; born 17 June 1979) is a Russian chess grandmaster, a former European champion and a former Russian champion. He is also Sergey Karjakin's trainer and one of the coaches of the Russian national team.",Alexander Motylev
134,"Sergei Movsesian, 2573 games",Sergei Movsesian,Movsesian.pgn,Movsesian,Sergei,Movsesian,Sergei,Sergei Movsesian ,1978-11-03,,1997-01-01, Armenia,,Sergei+Movsesian+chess,https://en.wikipedia.org/w/index.php?search=Sergei+Movsesian+chess,"['Sergei Movsesian', 'Movsesian', 'Alexander Moroz (chess player)', 'Andrei Deviatkin', 'Mika Karttunen', 'Mark Paragua', 'Constantin Lupulescu', 'Slovak Chess Championship', 'Igor Kurnosov', 'List of Armenian chess players']",Sergei Movsesian,https://en.wikipedia.org/wiki/Sergei_Movsesian,"Sergei Movsesian (Armenian: Սերգեյ Մովսիսյան; born 3 November 1978 in Tbilisi) is an Armenian chess Grandmaster who played for the Czech Republic for most of his career. Later he represented Slovakia which offered him citizenship. On December 30, 2010 Movsesian started to represent his ancestral country of Armenia. He was a member of the gold medal-winning Armenian team at the 2011 World Team Chess Championship in Ningbo.",Sergei Movsesian
135,"Mariya Muzychuk, 1042 games",Mariya Muzychuk,Muzychuk.pgn,Muzychuk,Mariya,Muzychuk,Anna,,,,,,,Mariya+Muzychuk+chess,https://en.wikipedia.org/w/index.php?search=Mariya+Muzychuk+chess,"['Mariya Muzychuk', 'Muzychuk', 'Anna Muzychuk', ""Women's World Chess Championship 2015"", '2016 in chess', ""Women's World Chess Championship 2016"", 'Mariya', ""FIDE Women's Grand Prix 2015–16"", ""Women's event at the 42nd Chess Olympiad"", ""Women's World Team Chess Championship 2009""]",Mariya Muzychuk,https://en.wikipedia.org/wiki/Mariya_Muzychuk,"Mariya Olegivna Muzychuk (Ukrainian: Марія Олегівна Музичук; born 21 September 1992) is a Ukrainian chess player and Women's World Chess Champion from April 2015 to March 2016. She is also a twice women's champion of Ukraine (2012, 2013), World Team and European Team champion with Ukraine in 2013 and bronze medal winner of the 2012 and 2014 Chess Olympiad with Ukraine.",Mariya Muzychuk
136,"Miguel Najdorf, 1604 games",Miguel Najdorf,Najdorf.pgn,Najdorf,Miguel,Najdorf,Miguel,Miguel Najdorf,1910-04-15,1997-07-04,1950-01-01, Argentina,,Miguel+Najdorf+chess,https://en.wikipedia.org/w/index.php?search=Miguel+Najdorf+chess,"['Miguel Najdorf', 'Najdorf', 'Sicilian Defence, Najdorf Variation', 'Dallas 1957 chess tournament', 'Jiří Pelikán (chess player)', 'Chris de Ronde', 'Polish Immortal', 'Arturo Liebstein', 'Gideon Ståhlberg', 'Benito Villegas']",Miguel Najdorf,https://en.wikipedia.org/wiki/Miguel_Najdorf,"Miguel Najdorf (born Mojsze Mendel Najdorf) (15 April 1910 – 4 July 1997) was a Polish-Argentine chess grandmaster. Originally from Poland, he was in Argentina when World War II began in 1939, and he stayed and settled there. He was a leading world player in the 1940s and 1950s, and is also known for the Najdorf Variation, one of the most popular of all chess openings.",Miguel Najdorf
137,"Evgeny Najer, 1671 games",Evgeny Najer,Najer.pgn,Najer,Evgeny,Najer,Evgeniy,Evgeniy Najer ,1977-06-22,,1999-01-01, Russia,,Evgeny+Najer+chess,https://en.wikipedia.org/w/index.php?search=Evgeny+Najer+chess,"['Evgeniy Najer', 'Dmitry Jakovenko', 'World Open chess tournament', 'Lázaro Bruzón', 'Kaido Külaots', 'List of Russian chess players', 'Chess World Cup 2007', 'Chess World Cup 2005', 'Cappelle-la-Grande Open', 'Hou Yifan']",Evgeniy Najer,https://en.wikipedia.org/wiki/Evgeniy_Najer,Evgeniy Najer (Russian: Евгений Наер; born 22 June 1977 in Moscow) is a Russian chess grandmaster and the European champion of 2015. He is also one of the coaches of the Russian women's national team.,Evgeniy Najer
138,"Hikaru Nakamura, 2221 games",Hikaru Nakamura,Nakamura.pgn,Nakamura,Hikaru,Nakamura,Hikaru,Hikaru Nakamura ,1987-12-09,,2003-01-01, United States,,Hikaru+Nakamura+chess,https://en.wikipedia.org/w/index.php?search=Hikaru+Nakamura+chess,"['Hikaru Nakamura', 'Hikaru Nakamura (artist)', 'Hikaru', 'Zurich Chess Challenge', '2016 US Chess Championship', 'Jūni Taisen', 'Nakamura (surname)', 'Hikaru no Go', 'Laura Aspis Prize', '2011 in chess']",Hikaru Nakamura,https://en.wikipedia.org/wiki/Hikaru_Nakamura,"Hikaru Nakamura (ヒカル・ナカムラ, Nakamura Hikaru, born December 9, 1987) is an American chess grandmaster.
He is a four-time United States Chess Champion, who won the 2011 edition of Tata Steel Group A and represented the United States at five Chess Olympiads, winning a team gold medal and two team bronze medals. He has also written a book about bullet chess called Bullet Chess: One Minute to Mate.
His peak USCF rating was 2900 in August 2015. In October 2015, he reached his peak FIDE rating of 2816, which ranked him second in the world. In May 2014, when FIDE began publishing official rapid and blitz chess ratings, Nakamura ranked number one in the world on both lists.

",Hikaru Nakamura
139,"David Navara, 2081 games",David Navara,Navara.pgn,Navara,David,Navara,David,David Navara ,1985-03-27,,2002-01-01, Czech Republic,,David+Navara+chess,https://en.wikipedia.org/w/index.php?search=David+Navara+chess,"['David Navara', 'Navara', 'Czech Chess Championship', 'Yaroslav Zherebukh', 'Gadir Guseinov', '2013 European Individual Chess Championship', 'Soňa Pertlová', 'Vlastimil Jansa', 'FIDE Grand Prix 2008–10', 'Viktor Láznička']",David Navara,https://en.wikipedia.org/wiki/David_Navara,"David Navara (born 27 March 1985) is a Czech chess Grandmaster, the highest-ranked player of his country. He won seven times the Czech Chess Championship (in 2004, 2005, 2010, 2012, 2013, 2014 and 2015) and the European Blitz Chess Championship of 2014. As of the May 2015 FIDE rating list Navara achieved a personal high with an Elo rating of 2751 and was ranked number 14 in the world.",David Navara
140,"Parimarjan Negi, 1027 games",Parimarjan Negi,Negi.pgn,Negi,Parimarjan,Negi,Parimarjan,Parimarjan Negi ,1993-02-09,,2006-01-01, India,,Parimarjan+Negi+chess,https://en.wikipedia.org/w/index.php?search=Parimarjan+Negi+chess,"['Parimarjan Negi', 'Negi (surname)', 'Markus Ragger', 'Martyn Kravtsiv', 'Alexander Goloshchapov', 'Sergey Fedorchuk', 'Srinath Narayanan', 'Xtracon Chess Open', 'Ivana Maria Furtado', 'List of Indian chess players']",Parimarjan Negi,https://en.wikipedia.org/wiki/Parimarjan_Negi,"Parimarjan Negi (born 9 February 1993) is a chess grandmaster (GM) from India, a former Asian and Indian champion. He achieved the GM title at the age of 13 years and 142 days (13 years, 4 months, and 20 days) in 2006, becoming the second youngest chess grandmaster ever, second only to Sergey Karjakin.
Negi played on the top board for the bronze medal-winning Indian team in the 2014 Chess Olympiad in Tromsø, Norway.
He was granted the Arjuna Award in 2010 by the Government of India.",Parimarjan Negi
141,"Ian Nepomniachtchi, 1620 games",Ian Nepomniachtchi,Nepomniachtchi.pgn,Nepomniachtchi,Ian,Nepomniachtchi,Ian,Ian Nepomniachtchi ,1990-07-14,,2007-01-01, Russia,,Ian+Nepomniachtchi+chess,https://en.wikipedia.org/w/index.php?search=Ian+Nepomniachtchi+chess,"['Ian Nepomniachtchi', 'Nepomnyashchiy', 'Ivan Popov (chess player)', 'Constantin Lupulescu', 'Farrukh Amonatov', '2013 European Individual Chess Championship', 'Alexander Motylev', 'Center Game', 'Open event at the 42nd Chess Olympiad', 'Daniil Dubov']",Ian Nepomniachtchi,https://en.wikipedia.org/wiki/Ian_Nepomniachtchi,"Ian Aleksandrovich Nepomniachtchi (Russian: Ян Алекса́ндрович Непо́мнящий; born 14 July 1990) is a Russian chess grandmaster.
He was a member of the gold medal-winning Russian team at the 2013 World Team Chess Championship in Antalya and at the 2015 European Team Chess Championship in Reykjavík.
Nepomniachtchi won the 2010 Russian Superfinal and European Individual titles. He also won the 2016 Tal Memorial and 2008 and 2015 Aeroflot Open.
In October 2016, Nepomniachtchi was ranked fourth in the world in both rapid chess and blitz chess. He has won two silver medals in the World Rapid Championship and a silver medal at the World Blitz Championship as well as winning the 2008 Ordix Open.",Ian Nepomniachtchi
142,"Ni Hua, 1403 games",Ni Hua,Ni.pgn,Ni,Ni,Hua,Ni,Ni Hua ,1983-05-31,,2002-01-01, China,,Ni+Hua+chess,https://en.wikipedia.org/w/index.php?search=Ni+Hua+chess,"['Ni Hua', 'Huahujing', 'Ni (surname)', 'Ni Wei-Tou', 'Ni Weidou', 'Huang Hua', 'Hua Jianmin', 'Zhang Ni', 'Bu Xiangzhi', 'Battle of Chipyong-ni']",Ni Hua,https://en.wikipedia.org/wiki/Ni_Hua,"Ni Hua (born May 31, 1983 in Shanghai) is a Chinese chess grandmaster and the national team captain. He is three-time national champion. In 2003, he became China's 15th Grandmaster at the age of 19. In April 2008, Ni Hua and Bu Xiangzhi both became the second and third Chinese players to pass the 2700 Elo rating mark, after Wang Yue.
He was a member of the gold medal-winning Chinese team at the 41st Chess Olympiad.",Ni Hua
143,"Peter Nielsen, 2040 games",Peter Nielsen,Nielsen.pgn,Nielsen,Peter,Nielsen,,,,,,,,Peter+Nielsen+chess,https://en.wikipedia.org/w/index.php?search=Peter+Nielsen+chess,"['Peter Nielsen', 'Peter Nielsen (sport shooter)', 'Hans Peter Nielsen', 'Peter Meinert Nielsen', 'Peter Nielsen (actor)', 'Peter Nielsen (footballer)', 'Anders Nielsen', 'Peter Heine Nielsen', 'Anders Peter Nielsen', 'Peter Nielsen (botanist)']",Peter Nielsen,https://en.wikipedia.org/wiki/Peter_Heine_Nielsen,"Peter Heine Nielsen (born May 24, 1973) is a Danish chess player, and the current coach of chess world champion Magnus Carlsen.",Peter Heine Nielsen
