162,"Zsuzsa Polgar, 909 games",Zsuzsa Polgar,PolgarZ.pgn,PolgarZ,Zsuzsa,Polgar,Zsuzsa,Zsuzsa Polgar ,1969-04-19,,1991-01-01, United States,,Zsuzsa+Polgar+chess,https://en.wikipedia.org/w/index.php?search=Zsuzsa+Polgar+chess,"['Susan Polgar', ""Women's World Chess Championship 1996"", 'László Polgár', 'MChess Pro', 'Judit Polgár', 'Alisa Galliamova', '29th Chess Olympiad', 'Gábor Kállai', 'Hungarian Chess Championship', '28th Chess Olympiad']",Susan Polgar,https://en.wikipedia.org/wiki/Susan_Polgar,"Susan Polgar (born April 19, 1969, as Polgár Zsuzsanna and often known as Zsuzsa Polgár) is a Hungarian-born American chess Grandmaster. She is famous for having been a child prodigy at chess, for being a pioneer for women in chess, and for being an advocate for chess in education. She is an Olympic and World chess champion, a chess teacher, coach, writer and promoter and the head of the Susan Polgar Institute for Chess Excellence (SPICE)[1] at Webster University as well as the head coach for the 2011 and 2012 National Championship college chess teams at Texas Tech University and the 2013, 2014, 2015, 2016 and 2017 National Championship teams at Webster University.[2][3] The U.S. Collegiate championship has been contested each year since 2001 at the Final Four of College Chess, also known as the President's Cup. She is the oldest of the famous ""Polgár sisters"": Zsuzsa, Zsófia, and Judit. She was the first woman to earn the grandmaster title through tournament play, and is credited with breaking a number of gender barriers in chess.
On the July 1984 FIDE Rating List, at the age of 15, she became the top-ranked woman player in the world, and remained ranked in the top three for the next 23 years. She was also the first woman in history to break the gender barrier by qualifying for the 1986 ""Men's"" World Championship. She was the Women's World Chess Champion from 1996 to 1999 (in Classical time control). She won the World Blitz and Rapid Championships in 1992. In October 2005, Polgar had an Elo rating of 2577, making her the second-ranked woman in the world at the time, after her sister Judit. Polgar went on to win ten Olympic medals (5 gold, 4 silver and 1 bronze) and four Women's World Championships. She has not played in official competition since 2006.
In 1997, Polgar founded the Polgar Chess Center in Forest Hills, New York to give chess training to children. The Polgar Chess Center closed in 2009 following her relocation to Texas Tech University in Lubbock, Texas. In 2002, she established the Susan Polgar Foundation. Since then, her foundation has sponsored the National Invitational for Girls, National Open Championship for Boys and Girls, World Open Championship for Boys and Girls, All-Star Girl's Chess Team, NY City Mayor's Cup Invitational, Tri-State Scholastic Chess Challenge, SPICE Cup and a series of Get Smart Play Chess scholastic chess tournaments. She founded the SPICE Institute in Texas in 2007 and began coaching the Texas Tech Knight Raiders in 2007 as well. As of January 2009, she has been the Co-Chairperson of the Commission for Women's Chess for the World Chess Federation FIDE.",Susan Polgar
163,"Lev Polugaevsky, 1890 games",Lev Polugaevsky,Polugaevsky.pgn,Polugaevsky,Lev,Polugaevsky,Lev,Lev Polugaevsky,1934-11-20,1995-08-30,1962-01-01, Russia,,Lev+Polugaevsky+chess,https://en.wikipedia.org/w/index.php?search=Lev+Polugaevsky+chess,"['Lev Polugaevsky', 'Aleksey Goganov', 'Semen Dvoirys', 'Lev (given name)', 'Jan Smejkal', 'Phillips & Drew Kings', 'Alexander Zaitsev (chess player)', 'Henrique Mecking', '1976 in chess', 'Eric Lobron']",Lev Polugaevsky,https://en.wikipedia.org/wiki/Lev_Polugaevsky,"Lev Abramovich Polugaevsky (Russian: Лев Абрамович Полугаевский; 20 November 1934 – 30 August 1995) was an International Grandmaster of chess and frequent contender for the World Championship, although he never achieved that title. He was one of the strongest players in the world from the early 1960s until the late 1980s, as well as a distinguished author and opening theorist whose contributions in this field remain important to the present day.",Lev Polugaevsky
164,"Ruslan Ponomariov, 1897 games",Ruslan Ponomariov,Ponomariov.pgn,Ponomariov,Ruslan,Ponomariov,Ruslan,Ruslan Ponomariov ,1983-10-11,,1998-01-01, Ukraine,,Ruslan+Ponomariov+chess,https://en.wikipedia.org/w/index.php?search=Ruslan+Ponomariov+chess,"['Ruslan Ponomariov', 'M-Tel Masters', 'Ruslan (given name)', 'Ponomaryov', 'Sergei Rublevsky', 'Chess World Cup 2009', 'Yuri Drozdovskij', '2002 in chess', 'Étienne Bacrot', 'Chess World Cup 2007']",Ruslan Ponomariov,https://en.wikipedia.org/wiki/Ruslan_Ponomariov,"Ruslan Olegovich Ponomariov (Ukrainian: Русла́н Оле́гович Пономарьо́в, Ruslan Olehovych Ponomar'ov; born 11 October 1983) is a Ukrainian chess player and FIDE World Chess Champion between 2002 and 2004.
He was runner-up in the Chess World Cup 2005 and Chess World Cup 2009, while reaching the semi-finals in 2011 and the quarterfinals in 2007.",Ruslan Ponomariov
165,"Lajos Portisch, 3030 games",Lajos Portisch,Portisch.pgn,Portisch,Lajos,Portisch,Lajos,Lajos Portisch,1937-04-04,,1961-01-01, Hungary,,Lajos+Portisch+chess,https://en.wikipedia.org/w/index.php?search=Lajos+Portisch+chess,"['Lajos Portisch', 'Lajos', 'Tata Steel Chess Tournament', 'József Pintér', 'Phillips & Drew Kings', 'István Csom', 'Pál Réthy', 'San Antonio 1972 chess tournament', 'Wolfgang Unzicker', 'Burt Hochberg']",Lajos Portisch,https://en.wikipedia.org/wiki/Lajos_Portisch,"Lajos Portisch (born 4 April 1937) is a Hungarian chess Grandmaster, whose positional style earned him the nickname, the ""Hungarian Botvinnik"". One of the strongest non-Soviet players from the early 1960s into the late 1980s, he participated in twelve consecutive Interzonals from 1962 through 1993, qualifying for the World Chess Championship Candidates' cycle a total of eight times (1965, 1968, 1974, 1977, 1980, 1983, 1985, and 1988). Portisch set several all-time records in Chess Olympiads. In Hungarian Chess Championships, he either shared the title or won it outright a total of eight times (1958, 1959, 1961, 1964, 1965, 1971, 1975, and 1981). He won many strong international tournaments during his career. In 2004, Portisch was awarded the 'Nemzet Sportoloja', Hungary's highest national sports achievement award.
He still competes occasionally at his age. His main hobby is singing operatic arias; he has a fine baritone voice, a quality shared by Vasily Smyslov, a chess world champion and grandmaster who also had talent as an operatic singer. His younger brother, Ferenc (born 1939), is an International Master.",Lajos Portisch
166,"Lev Psakhis, 1963 games",Lev Psakhis,Psakhis.pgn,Psakhis,Lev,Psakhis,Lev,Lev Psakhis ,1958-11-29,,1982-01-01, Israel,,Lev+Psakhis+chess,https://en.wikipedia.org/w/index.php?search=Lev+Psakhis+chess,"['Lev Psakhis', 'Lexy Ortega', 'Alexander Huzman', 'Boris Avrukh', 'List of Israeli chess players', 'Yury Dokhoian', 'Sicilian Defence, Katalymov Variation', 'Alexey Vyzmanavin', '1981 in chess', 'Valerij Zhuravliov']",Lev Psakhis,https://en.wikipedia.org/wiki/Lev_Psakhis,"Lev Borisovich Psakhis (Hebrew: לב בוריסוביץ' פסחיס‎‎; Лев Борисович Псахис; born 29 November 1958 in Krasnoyarsk, Russia) is a naturalised Israeli chess grandmaster, trainer and author. Born in Siberia, he is also a two-time former champion of the Soviet Union.",Lev Psakhis
167,"Miguel Quinteros, 1136 games",Miguel Quinteros,Quinteros.pgn,Quinteros,Miguel,Quinteros,Miguel,Miguel Quinteros ,1947-12-28,,1973-01-01, Argentina,,Miguel+Quinteros+chess,https://en.wikipedia.org/w/index.php?search=Miguel+Quinteros+chess,"['Miguel Quinteros', 'Miguel Caro Quintero', 'Quinteros', 'Sonora Cartel', 'Ivan Radulov', 'Miguel Ángel Navarro Quintero', 'Carlos Quinteros', 'Rafael Caro Quintero', 'Guatemalan Party of Labour – Communist Party', 'Victor Ciocâltea']",Miguel Quinteros,https://en.wikipedia.org/wiki/Miguel_Quinteros,"Miguel Ángel Quinteros (born December 28, 1947 in Buenos Aires) is an Argentine chess grandmaster.",Miguel Quinteros
168,"Teimour Radjabov, 1741 games",Teimour Radjabov,Radjabov.pgn,Radjabov,Teimour,Radjabov,Teimour,Teimour Radjabov ,1987-03-12,,2001-01-01, Azerbaijan,,Teimour+Radjabov+chess,https://en.wikipedia.org/w/index.php?search=Teimour+Radjabov+chess,"['Teimour Radjabov', 'Rubén Felgaer', 'Shamkir Chess', 'Alexander Goloshchapov', 'Murtas Kazhgaleyev', 'Eltaj Safarli', 'FIDE Grand Prix 2012–13', 'Vugar Gashimov', 'FIDE Grand Prix 2008–10', 'Gadir Guseinov']",Teimour Radjabov,https://en.wikipedia.org/wiki/Teimour_Radjabov,"Teimour Radjabov (also spelled Teymur Rajabov; Azerbaijani: Teymur Rəcəbov; born 12 March 1987) is an Azerbaijani chess Grandmaster.
A child prodigy, Radjabov earned the title of Grandmaster in March 2001 at the age of 14, making him the second-youngest grandmaster in history at the time. At the age of 16, he defeated the World Champion Garry Kasparov at the Linares tournament. He also become the second youngest player in history to enter the FIDE Top 100 Players list.
In his later career, Radjabov remained an elite chess player. He has twice competed at the Candidates Tournaments in 2012 and 2013 and twice won the European Team Chess Championship with Azerbaijan in 2009 and 2013. Radjabov achieved his peak rating of 2793 in November 2012, and was rated as #4 in the world at the same time.",Teimour Radjabov
169,"Samuel Reshevsky, 1267 games",Samuel Reshevsky,Reshevsky.pgn,Reshevsky,Samuel,Reshevsky,Samuel,Samuel Reshevsky,1911-11-26,1992-04-04,1950-01-01, United States,,Samuel+Reshevsky+chess,https://en.wikipedia.org/w/index.php?search=Samuel+Reshevsky+chess,"['Samuel Reshevsky', 'Dallas 1957 chess tournament', 'World Chess Championship 1969', 'José Joaquín Araiza', 'Jacob Levin (chess player)', 'David Polland', 'Kemeri 1937 chess tournament', 'István Csom', 'Albert Simonson', 'Renato Naranja']",Samuel Reshevsky,https://en.wikipedia.org/wiki/Samuel_Reshevsky,"Samuel ""Sammy"" Herman Reshevsky (born Szmul Rzeszewski; November 26, 1911 – April 4, 1992) was a Polish chess prodigy and later a leading American chess grandmaster. He was never a full-time chess professional. He was a strong contender for the World Chess Championship from the mid-1930s to the mid-1960s: he tied for third place in the 1948 World Chess Championship tournament, and tied for second in the 1953 Candidates Tournament. He was an eight-time winner of the U.S. Chess Championship. An outstanding match player throughout his career, Reshevsky excelled at positional play, and could be a brilliant tactician when required. He took a long time over his opening moves, and often found himself in time pressure, but this sometimes unsettled his opponent more than it did Reshevsky.
He was an accountant by profession, and a well-regarded chess writer.",Samuel Reshevsky
170,"Richard Reti, 646 games",Richard Reti,Reti.pgn,Reti,Richard,Reti,,,,,,,,Richard+Reti+chess,https://en.wikipedia.org/w/index.php?search=Richard+Reti+chess,"['Richard Réti', 'Reti', 'Réti Opening', 'Rudolph Reti', 'Réti endgame study', 'Moravská Ostrava 1923 chess tournament', 'Hypermodernism (chess)', 'Henri Weenink', 'Carl Schlechter Memorial Tournament', 'Josef Krejcik']",Richard Réti,https://en.wikipedia.org/wiki/Richard_R%C3%A9ti,"Richard Réti (28 May 1889, Bösing, now Pezinok – 6 June 1929, Prague) was an Austro-Hungarian, later Czechoslovak chess grandmaster, chess author, and composer of endgame studies.
He was one of the principal proponents of hypermodernism in chess. With the exception of Nimzowitsch's book My System, he is considered to be the movement's foremost literary contributor.",Richard Réti
171,"Zoltan Ribli, 2162 games",Zoltan Ribli,Ribli.pgn,Ribli,Zoltan,Ribli,Zoltán,Zoltán Ribli ,1951-09-06,,1973-01-01, Hungary,,Zoltan+Ribli+chess,https://en.wikipedia.org/w/index.php?search=Zoltan+Ribli+chess,"['Zoltán Ribli', 'Phillips & Drew Kings', 'World Chess Championship 1984', 'Mihai Suba', 'International Arbiter', 'Hungarian Chess Championship', 'Gábor Kállai', 'Victor Ciocâltea', '1975 in chess', 'András Adorján']",Zoltán Ribli,https://en.wikipedia.org/wiki/Zolt%C3%A1n_Ribli,"Zoltán Ribli (born September 6, 1951 in Mohács) is a Hungarian chess grandmaster and International Arbiter (1995). He was twice a World Championship Candidate and three times Hungarian Champion.",Zoltán Ribli
172,"Michael Rohde, 445 games",Michael Rohde,Rohde.pgn,Rohde,Michael,Rohde,Michael,Michael Rohde ,1959-08-26,,1988-01-01, United States,,Michael+Rohde+chess,https://en.wikipedia.org/w/index.php?search=Michael+Rohde+chess,"['Michael Rohde', 'Michael Rohde (chess player)', 'Michael Rohde (botanist)', 'Rohde', 'Michael Rohde (footballer)', 'Joe Rohde', 'Erwin Rohde', 'David S. Rohde', 'Major Rohde Hawkins', 'Kidnapping of David Rohde']",Michael Rohde,https://en.wikipedia.org/wiki/Michael_Rohde_(chess_player),"Michael Rohde (born August 26, 1959) is an American chess grandmaster and attorney-at-law.
Rohde was rated as a master at thirteen. He gained the International Master title in 1976, followed by that of Grandmaster in 1988. At one point, he was ranked as high as 59th in the world.
In 1975 he was the National Scholastic Chess Champions Junior High School Champion, and the following year he was the High School Champion. He won first place in the U.S. Open in 1991 as well as several other titles. He wrote the ""Game of the Month"" column for Chess Life from 1991 to 2006.
In August 2007, Rohde tied for first in the U.S. Open Championship in Cherry Hill, New Jersey.",Michael Rohde (chess player)
173,"Akiba Rubinstein, 797 games",Akiba Rubinstein,Rubinstein.pgn,Rubinstein,Akiba,Rubinstein,Akiba,Akiba Rubinstein,1882-10-12,1961-03-15,1950-01-01, Poland,,Akiba+Rubinstein+chess,https://en.wikipedia.org/w/index.php?search=Akiba+Rubinstein+chess,"['Akiba Rubinstein', 'Rotlewi versus Rubinstein', 'Rubinstein Memorial', ""Queen's Gambit Declined, Rubinstein Trap"", 'Akiba (given name)', 'Rubinstein', 'Paul Johner', 'Solomon Globus', 'Akiva (given name)', 'Dawid Daniuszewski']",Akiba Rubinstein,https://en.wikipedia.org/wiki/Akiba_Rubinstein,"Akiba Kiwelowicz Rubinstein (1 December 1880 – 14 March 1961) was a Polish chess grandmaster who is considered to have been one of the strongest players never to have become World Chess Champion.
In his youth, he defeated top players such as José Raúl Capablanca and Carl Schlechter and was scheduled to play a match with Emanuel Lasker for the World Chess Championship in 1914, but it was cancelled due to the outbreak of World War I. He was unable to recreate the same form after the war, and his later life was plagued by mental illness.",Akiba Rubinstein
174,"Sergei Rublevsky, 1666 games",Sergei Rublevsky,Rublevsky.pgn,Rublevsky,Sergei,Rublevsky,Sergei,Sergei Rublevsky ,1974-10-15,,1994-01-01, Russia,,Sergei+Rublevsky+chess,https://en.wikipedia.org/w/index.php?search=Sergei+Rublevsky+chess,"['Sergei Rublevsky', 'Maxim Sorokin', 'Rublev (surname)', 'Vladimir Burmakin', 'Chess World Cup 2005', 'Đào Thiên Hải', 'Ildar Khairullin', 'Zdenko Kožul', 'Chess World Cup 2007', 'Shen Yang (chess player)']",Sergei Rublevsky,https://en.wikipedia.org/wiki/Sergei_Rublevsky,"Sergei Rublevsky (born 15 October 1974) is a Russian chess grandmaster (1994). He has won four team gold medals and one individual bronze medal at Chess Olympiads. He won the prestigious Aeroflot Open in 2004, and became the 58th Russian chess champion after winning the Russian Superfinal in Moscow (18–30 December 2005), one point clear from Dmitry Jakovenko and Alexander Morozevich.
He finished in the top 10 in the 2005 FIDE World Cup, which qualified him for the Candidates Tournament for the FIDE World Chess Championship 2007, played in May–June 2007. He defeated Ruslan Ponomariov 3½-2½ in the first round. In the second round he played Alexander Grischuk. The match was tied 3-3, but Grischuk won the rapid playoff 2½-½, eliminating Rublevsky from the championship.",Sergei Rublevsky
175,"Friedrich Saemisch, 551 games",Friedrich Saemisch,Saemisch.pgn,Saemisch,Friedrich,Saemisch,,,,,,,,Friedrich+Saemisch+chess,https://en.wikipedia.org/w/index.php?search=Friedrich+Saemisch+chess,"['Friedrich Sämisch', 'Carl Friedrich Richard Förster', 'Hans Kmoch', 'Julius von Michel', 'Alexander Pagenstecher', 'Heinrich Schiess-Gemuseus', 'Karl Mellinger', 'Aron Nimzowitsch', 'Immortal Zugzwang Game', 'Arturo Pomar']",Friedrich Sämisch,https://en.wikipedia.org/wiki/Friedrich_S%C3%A4misch,"Friedrich (Fritz) Sämisch (September 20, 1896, Charlottenburg – August 16, 1975, Berlin) was a German chess Grandmaster (1950).",Friedrich Sämisch
176,"Konstantin Sakaev, 1505 games",Konstantin Sakaev,Sakaev.pgn,Sakaev,Konstantin,Sakaev,Konstantin,Konstantin Sakaev ,1974-04-13,,1992-01-01, Russia,,Konstantin+Sakaev+chess,https://en.wikipedia.org/w/index.php?search=Konstantin+Sakaev+chess,"['Konstantin Sakaev', 'Chess World Cup 2005', 'Andrey Lukin', 'Dimitrios Mastrovasilis', 'Alexei Bezgodov', 'Igor-Alexandre Nataf', 'Dmitry Andreikin', 'Nikita Vitiugov', 'Alexander Cherepkov', 'List of Russian chess players']",Konstantin Sakaev,https://en.wikipedia.org/wiki/Konstantin_Sakaev,"Konstantin Sakaev (Russian: Константин Сакаев; born 13 April 1974 in Leningrad) is a Russian chess Grandmaster (1993), chess author and Russian champion in 1999. Sakaev is on the staff of the Grandmaster Chess School in St. Petersburg and has assisted Vladimir Kramnik and Nana Ioseliani while preparing for World Championship Candidates' Matches.
He was born in a Tatar family.",Konstantin Sakaev
177,"Valery Salov, 766 games",Valery Salov,Salov.pgn,Salov,Valery,Salov,Valery,Valery Salov ,1964-05-26,,1986-01-01, Russia,,Valery+Salov+chess,https://en.wikipedia.org/w/index.php?search=Valery+Salov+chess,"['Valery Salov', 'Salov (surname)', '1994 in chess', '1995 in chess', '1993 in chess', 'World Chess Championship 1990', '1991 in chess', '1989 in chess', '1997 in chess', 'Tata Steel Chess Tournament']",Valery Salov,https://en.wikipedia.org/wiki/Valery_Salov,"Valery Salov (born May 26, 1964 in Wrocław, Poland) is a Russian chess grandmaster who was once ranked the third best player in the world.",Valery Salov
178,"Krishnan Sasikiran, 1551 games",Krishnan Sasikiran,Sasikiran.pgn,Sasikiran,Krishnan,Sasikiran,Krishnan,Krishnan Sasikiran ,1981-01-07,,2000-01-01, India,,Krishnan+Sasikiran+chess,https://en.wikipedia.org/w/index.php?search=Krishnan+Sasikiran+chess,"['Krishnan Sasikiran', 'Sasi', 'M-Tel Masters', 'List of Tamil recipients of the Arjuna Award', 'Sergei Zhigalko', 'Alexander Goloshchapov', 'Asian Chess Championship', 'Abhijit Kunte', 'Commonwealth Chess Championship', 'List of Indian chess players']",Krishnan Sasikiran,https://en.wikipedia.org/wiki/Krishnan_Sasikiran,"Krishnan Sasikiran (born 7 January 1981) is an Indian chess grandmaster.
He was one of Viswanathan Anand's seconds in the World Chess Championship 2013.",Krishnan Sasikiran
179,"Carl Schlechter, 739 games",Carl Schlechter,Schlechter.pgn,Schlechter,Carl,Schlechter,,,,,,,,Carl+Schlechter+chess,https://en.wikipedia.org/w/index.php?search=Carl+Schlechter+chess,"['Carl Schlechter', 'Carl Schlechter Memorial Tournament', 'World Chess Championship 1910 (Lasker–Schlechter)', 'Schlechter', 'Hugo Fähndrich', 'Hugo Süchting', 'Leopold Trebitsch Memorial Tournament', ""Carl Haffner's Love of the Draw"", 'Richard Teichmann', 'Walter John']",Carl Schlechter,https://en.wikipedia.org/wiki/Carl_Schlechter,Carl Schlechter (2 March 1874 – 27 December 1918) was a leading Austrian chess master and theoretician at the turn of the 20th century. He is best known for drawing a World Chess Championship match with Emanuel Lasker.,Carl Schlechter
180,"Yasser Seirawan, 1519 games",Yasser Seirawan,Seirawan.pgn,Seirawan,Yasser,Seirawan,Yasser,Yasser Seirawan ,1960-03-24,,1980-01-01, United States,,Yasser+Seirawan+chess,https://en.wikipedia.org/w/index.php?search=Yasser+Seirawan+chess,"['Yasser Seirawan', 'Seirawan chess', 'Yasser', 'Neo-Indian Attack', 'Duncan Suttles', 'Nikolay Minev', 'List of Syrians', 'Phillips & Drew Kings', 'Iván Salgado López', 'Everyman Chess']",Yasser Seirawan,https://en.wikipedia.org/wiki/Yasser_Seirawan,"Yasser Seirawan (Arabic: ياسر سيروان‎‎; born March 24, 1960) is a chess grandmaster and four-time United States champion. He won the World Junior Chess Championship in 1979. Seirawan is also a published chess author and commentator.",Yasser Seirawan
181,"Gregory Serper, 848 games",Gregory Serper,Serper.pgn,Serper,Gregory,Serper,Gregory,Gregory Serper ,1969-09-14,,1992-01-01, United States,,Gregory+Serper+chess,https://en.wikipedia.org/w/index.php?search=Gregory+Serper+chess,"['Gregory Serper', 'Alex Yermolinsky', 'World Open chess tournament', 'Chess.com', '1969 in chess', 'List of Russian chess players', '7th State Duma of the Russian Federation', 'List of world records in chess', 'Classical World Chess Championship 1995', 'List of nationality transfers in chess']",Gregory Serper,https://en.wikipedia.org/wiki/Gregory_Serper,"Gregory Serper (Russian: Григорий Юрьевич Серпер) (born September 14, 1969) is a Grand Master of chess. 
He was born in Tashkent, in the former Uzbek Soviet Socialist Republic of the Soviet Union (present Uzbekistan). At age 6, he learned to play chess from his grandfather. In 1985, at age 16, he started studies at Moscow's famous Botvinnik-Kasparov Chess School.
During his military service in Novosibirsk, he attended the 27th World Junior Chess Championship held in 1988 in Adelaide, Australia. In this strong tournament Serper took 3rd place with same score 9/13 as his opponents Lautier, Ivanchuk and Gelfand who took 1st, 2nd and 4th place respectively.
In 1992, as a member of the Uzbekistan team, Serper won the silver medal in the 30th Chess Olympiad.
In January 1996 he moved with his family to the United States. In 1999, Serper won the World Open tournament after drawing an Armageddon playoff game as Black against Boris Gulko, who had been one of nine players who had tied with Serper in the main event. In the same year, he advanced to the finals of the U.S. Chess Championship by defeating Alex Yermolinsky in the semifinals, but lost in the finals to Gulko.
Gregory writes regular articles for Chess.com under the username ""Gserper"".",Gregory Serper
182,"Alexander Shabalov, 2256 games",Alexander Shabalov,Shabalov.pgn,Shabalov,Alexander,Shabalov,Alexander,Alexander Shabalov ,1967-09-12,,1991-01-01, United States,,Alexander+Shabalov+chess,https://en.wikipedia.org/w/index.php?search=Alexander+Shabalov+chess,"['Alexander Shabalov', 'Alexander Malevinsky', 'Alex Yermolinsky', 'Utut Adianto', '2016 US Chess Championship', 'Pennsylvania State Chess Federation', 'Alexander Moiseenko', 'Elshan Moradi', 'Darmen Sadvakasov', 'Diego Flores']",Alexander Shabalov,https://en.wikipedia.org/wiki/Alexander_Shabalov,"Alexander Shabalov (Russian: Александр Анатольевич Шабалов, Aleksandr Anatolyevich Shabalov; Latvian: Aleksandrs Šabalovs; born September 12, 1967) is an American chess grandmaster and a four-time winner of the United States Chess Championship (1993, 2000, 2003, 2007). He also won or tied for first place seven times in the U.S. Open Chess Championship (1993, 1999, 2003, 2007, 2008, 2015, 2016).
In 2002 he tied for first place at the Aeroflot Open in Moscow with Gregory Kaidanov, Alexander Grischuk, Aleksej Aleksandrov and Vadim Milov. In 2009 Shabalov shared first place with Fidel Corrales Jimenez in the American Continental Chess Championship.
He was born in Riga, Latvia, and like his fellow Latvians Alexei Shirov and Mikhail Tal, he is known for courting complications even at the cost of objective soundness.
Shabalov regularly lectured chess players of all ages at the House of Chess, a store that he ran at the Ross Park Mall in Pittsburgh, Pennsylvania, until it closed in mid-2007.
In 2015 he was inducted into the U.S. Chess Hall of Fame.",Alexander Shabalov
183,"Leonid Shamkovich, 977 games",Leonid Shamkovich,Shamkovich.pgn,Shamkovich,Leonid,Shamkovich,Leonid,Leonid Shamkovich,1923-06-01,2005-04-22,1965-01-01, United States,,Leonid+Shamkovich+chess,https://en.wikipedia.org/w/index.php?search=Leonid+Shamkovich+chess,"['Leonid Shamkovich', 'Eric Schiller', 'Lhamsuren Myagmarsuren', '2005 in chess', 'List of Israeli chess players', 'Elisabeta Polihroniade', 'Prince (disambiguation)', 'Anatoly Lein', 'Milan Vukcevich', 'Nikolai Krogius']",Leonid Shamkovich,https://en.wikipedia.org/wiki/Leonid_Shamkovich,"Leonid Aleksandrovich Shamkovich (Russian: Леони́д Алекса́ндрович Шамко́вич; June 1, 1923 – April 22, 2005) was a chess Grandmaster, and chess writer.
He was born in a Jewish family in Rostov-on-Don in Russia.",Leonid Shamkovich
184,"Alexei Shirov, 3576 games",Alexei Shirov,Shirov.pgn,Shirov,Alexei,Shirov,Alexei,Alexei Shirov ,1972-07-04,,1990-01-01, Latvia,,Alexei+Shirov+chess,https://en.wikipedia.org/w/index.php?search=Alexei+Shirov+chess,"['Alexei Shirov', 'Robert Hovhannisyan', 'Classical World Chess Championship 2000', 'Normunds Miezis', 'Vladimir Fedoseev', 'FIDE World Chess Championship 2000', 'Alexander Shabalov', 'Ilya Gurevich', '4NCL', 'Chess World Cup 2007']",Alexei Shirov,https://en.wikipedia.org/wiki/Alexei_Shirov,"Alexei Shirov, Latvian: Aleksejs Širovs; born 4 July 1972) is a Latvian chess grandmaster. He was ranked number two in 1994.",Alexei Shirov
